Nome,Lattes
ALEXANDRE CESAR MUNIZ DE OLIVEIRA,http://lattes.cnpq.br/5225588855422632
ANDRE CASTELO BRANCO SOARES,
ANDRE MACEDO SANTANA,
ANSELMO CARDOSO DE PAIVA,http://lattes.cnpq.br/6446831084215512
ANTONIO OSEAS DE CARVALHO FILHO,
AREOLINO DE ALMEIDA NETO,http://lattes.cnpq.br/8041675571955870
ARISTOFANES CORREA SILVA,http://lattes.cnpq.br/2446301582459104
CARLOS DE SALLES SOARES NETO,http://lattes.cnpq.br/1512846862093142
DAVI VIANA DOS SANTOS,http://lattes.cnpq.br/9297257833779277
FLÁVIO HENRIQUE DUARTE DE ARAÚJO,
FRANCISCO AIRTON PEREIRA DA SILVA,
FRANCISCO JOSE DA SILVA E SILVA,http://lattes.cnpq.br/0770343284012942
GERALDO BRAZ JUNIOR,http://lattes.cnpq.br/8287861610873629
GUILHERME AMARAL AVELINO,
IVAN SARAIVA SILVA,
JOAO CARLOS DE OLIVEIRA SOUZA,
JOAO DALLYSON SOUSA DE ALMEIDA,http://lattes.cnpq.br/6047330108382641
JOSE VALDEMIR DOS REIS JUNIOR,
JOÃO XAVIER DA CRUZ NETO,
KELSON RÔMULO TEIXEIRA AIRES,
LUCIANO REIS COUTINHO,http://lattes.cnpq.br/5901564732655853
LUIS JORGE ENRIQUE RIVERO CABREJOS,http://lattes.cnpq.br/8534667641706692
MARIO ANTONIO MEIRELES TEIXEIRA,http://lattes.cnpq.br/9943003955628885
PAULO SÉRGIO MARQUES DOS SANTOS,
PEDRO DE ALCANTARA DOS SANTOS NETO,
RICARDO DE ANDRADE LIRA RABÊLO,
RODRIGO DE MELO SOUZA VERAS,
ROMUERE RODRIGUES VELOSO E SILVA,http://lattes.cnpq.br/3734588405818556
VINICIUS PONTE MACHADO,
